{
  "models": [
    {
      "id": "-updated",
      "name": "SVA-001",
      "description": "å†œæ™“åŒ»ï¼ˆSVA001ï¼‰ï¼Œä¸“ä¸šå…½åŒ»",
      "provider": "shengnong",
      "maxTokens": 2000,
      "temperature": 0.7,
      "isDefault": true
    },
    {
      "id": "sva-002",
      "name": "SVA-002-ç›²æµ‹",
      "description": "å†œæ™“åŒ»ï¼ˆSVA002ï¼‰ï¼Œå¿«é€Ÿå“åº”",
      "provider": "openai",
      "maxTokens": 2000,
      "temperature": 0.7,
      "isDefault": false
    }
  ],
  "systemPrompt": "ä½ æ˜¯ç¥å†œé›†å›¢çš„æ™ºèƒ½å†œç‰§åŠ©æ‰‹[ç¥å†œæ™“é—®]ï¼Œä¸“é—¨ä¸ºç”¨æˆ·æä¾›å†œç‰§ä¸šç”Ÿäº§ã€ç®¡ç†ã€æŠ€æœ¯ç­‰æ–¹é¢çš„ä¸“ä¸šå’¨è¯¢å’Œç³»ç»Ÿæ“ä½œæŒ‡å¯¼ã€‚è¯·ç”¨ä¸­æ–‡å›ç­”ï¼Œè¯­æ°”è¦å‹å¥½ä¸“ä¸šã€‚",
  "quickReplies": [
    {
      "category": "production",
      "label": "ç”Ÿäº§ç®¡ç†",
      "replies": [
        "ç”Ÿäº§ç®¡ç†ç³»ç»Ÿæ€ä¹ˆä½¿ç”¨ï¼Ÿ",
        "å¦‚ä½•æŸ¥çœ‹ç”Ÿäº§æŠ¥è¡¨ï¼Ÿ",
        "ç”Ÿäº§è®¡åˆ’æ€ä¹ˆåˆ¶å®šï¼Ÿ",
        "å¦‚ä½•è®°å½•ç”Ÿäº§æ•°æ®ï¼Ÿ"
      ]
    },
    {
      "category": "breeding",
      "label": "æ™ºæ…§å…»æ®–",
      "replies": [
        "æ™ºæ…§å…»æ®–æœ‰å“ªäº›åŠŸèƒ½ï¼Ÿ",
        "å¦‚ä½•ç›‘æ§åŠ¨ç‰©å¥åº·ï¼Ÿ",
        "ç¯å¢ƒå‚æ•°è®¾ç½®æŒ‡å—",
        "é¥²æ–™é…æ¯”å»ºè®®"
      ]
    },
    {
      "category": "data",
      "label": "æ•°æ®åˆ†æ",
      "replies": [
        "å¦‚ä½•è¿›è¡Œæ•°æ®åˆ†æï¼Ÿ",
        "å¦‚ä½•å¯¼å‡ºæ•°æ®ï¼Ÿ",
        "æŠ¥è¡¨ç”Ÿæˆæ­¥éª¤",
        "æ•°æ®å¼‚å¸¸å¤„ç†"
      ]
    },
    {
      "category": "help",
      "label": "ç³»ç»Ÿå¸®åŠ©",
      "replies": [
        "ç³»ç»Ÿæ“ä½œå¸®åŠ©",
        "å¸¸è§é—®é¢˜è§£ç­”",
        "å¦‚ä½•è”ç³»æŠ€æœ¯æ”¯æŒ",
        "åŠŸèƒ½ä½¿ç”¨æŒ‡å—"
      ]
    }
  ],
  "apiConfig": {
    "baseURL": "http://47.236.87.251:3000/api",
    "timeout": 30000,
    "retryConfig": {
      "maxRetries": 3,
      "baseDelay": 1000,
      "maxDelay": 10000
    }
  },
  "uiConfig": {
    "assistantName": "ç¥å†œæ™“é—®",
    "assistantAvatar": "ğŸ·",
    "userAvatar": "ğŸ‘¤",
    "theme": {
      "primaryColor": "#FF1493",
      "secondaryColor": "#FF69B4",
      "accentColor": "#DC143C"
    },
    "welcomeMessage": "æ‚¨å¥½ï¼æˆ‘æ˜¯ç¥å†œæ™“é—®ï¼Œæ‚¨çš„ä¸“å±æ™ºèƒ½å†œç‰§åŠ©æ‰‹ï¼ğŸ·âœ¨<br><br>è¯·å…ˆåœ¨è®¾ç½®ä¸­é…ç½®API Keyï¼Œç„¶åæˆ‘å°±èƒ½ä¸ºæ‚¨æä¾›ä¸“ä¸šçš„å†œç‰§ä¸šå’¨è¯¢æœåŠ¡äº†ï¼"
  }
}